"Epic","Feature","Story","FAILED","BROKEN","PASSED","SKIPPED","UNKNOWN"
"","Checkout and customer form fields: User complete shopping","","0","2","4","0","0"
"","Shopping functionality: User is able to add and remove items from cart","","0","0","4","0","0"
"","Menu functionality: Resetapp state function","","0","0","3","0","0"
"","Login functionality: User is login with invalid username and invalid password","","0","0","3","0","0"
"","The Internet Guinea Pig Website: As a user, I can log into the secure area","","0","0","6","0","0"
"","Login functionality: User is able to login successfully","","0","0","4","0","0"
"","Shopping functionality: Shopping:User buy two items go checkout page","","0","0","4","0","0"
"","Checkout and customer form fields: User complete Shopping","","0","0","1","0","0"
